{
  "chat_template_sha256": "e10ca381b1ccc5cf9db52e371f3b6651576caee0a630b452e2816b2d404d4b65",
  "file_count": 13,
  "files": [
    {
      "bytes": 7627,
      "path": "LICENSE",
      "sha256": "64e1b2889b7892e6bbe7a7ed5bfe6ff793c61f9d584345f8f41cf9f5cb30a369"
    },
    {
      "bytes": 44044,
      "path": "README.md",
      "sha256": "ed0e2e86f7a40c38b793b0a04dfd993b2c1dfb34906804f96b999f0bbd8d70e6"
    },
    {
      "bytes": 4691,
      "path": "USE_POLICY.md",
      "sha256": "a568f2ebc73cec3fd74ba2afd992d4e945a8c7a9d851f9b66163aac834b7b859"
    },
    {
      "bytes": 855,
      "path": "config.json",
      "sha256": "29e4c210b0d6ac178b16b2a255a568bdb23b581e50ca1ef6a6d071dd85704e6e"
    },
    {
      "bytes": 184,
      "path": "generation_config.json",
      "sha256": "189fb0c0d7fd8a527db217c0a60a0e013f0394cd8800f9697a666a9e75e5f7fd"
    },
    {
      "bytes": 4976698672,
      "path": "model-00001-of-00004.safetensors",
      "sha256": "2b1879f356aed350030bb40eb45ad362c89d9891096f79a3ab323d3ba5607668"
    },
    {
      "bytes": 4999802720,
      "path": "model-00002-of-00004.safetensors",
      "sha256": "09d433f650646834a83c580877bd60c6d1f88f7755305c12576b5c7058f9af15"
    },
    {
      "bytes": 4915916176,
      "path": "model-00003-of-00004.safetensors",
      "sha256": "fc1cdddd6bfa91128d6e94ee73d0ce62bfcdb7af29e978ddcab30c66ae9ea7fa"
    },
    {
      "bytes": 1168138808,
      "path": "model-00004-of-00004.safetensors",
      "sha256": "92ecfe1a2414458b4821ac8c13cf8cb70aed66b5eea8dc5ad9eeb4ff309d6d7b"
    },
    {
      "bytes": 23950,
      "path": "model.safetensors.index.json",
      "sha256": "146776fce3f6db1103aa6f249e65ee5544c5923ce6f971b092eee79aa6e5d37b"
    },
    {
      "bytes": 296,
      "path": "special_tokens_map.json",
      "sha256": "6f38c73729248f6c127296386e3cdde96e254636cc58b4169d3fd32328d9a8ec"
    },
    {
      "bytes": 9085657,
      "path": "tokenizer.json",
      "sha256": "79e3e522635f3171300913bb421464a87de6222182a0570b9b2ccba2a964b2b4"
    },
    {
      "bytes": 55351,
      "path": "tokenizer_config.json",
      "sha256": "177c7b61e616fecb84c17ce0591acb92c6c4d60e9ac5ababfb940ff23bbcd424"
    }
  ],
  "manifest_version": "packet-a-source-v1",
  "repository": "meta-llama/Llama-3.1-8B-Instruct",
  "revision": "0e9e39f249a16976918f6564b8830bc894c89659",
  "total_bytes": 16069779031
}
